{
  "id": "case-041",
  "category": "over-selection",
  "project": "aspnetcore",
  "task": "Kestrel connection accept path with a tight 5-file limit",
  "input": {
    "query": "how does the kestrel server accept incoming connections",
    "command": "ask-context",
    "budget": "small"
  },
  "expected": {
    "must_include": [
      "KestrelServer"
    ],
    "should_include": [
      "ConnectionDispatcher"
    ],
    "should_not_include": [
      "README.md"
    ],
    "max_files": 5,
    "max_bytes": 4000
  }
}
