{
  "id": "case-039",
  "category": "identifier-mismatch",
  "project": "express",
  "task": "NL settings enable/disable vs app.set/app.enable assignment-style symbols",
  "input": {
    "query": "how do application settings get enabled and disabled",
    "command": "ask-context",
    "budget": "small"
  },
  "expected": {
    "must_include": [
      "lib/application.js"
    ],
    "should_include": [
      "enable"
    ],
    "should_not_include": [
      "README.md"
    ],
    "max_files": 8,
    "max_bytes": 5000
  }
}
