{
  "id": "case-028",
  "category": "concept-recall",
  "project": "react",
  "task": "Find the scheduler priority logic from an update-ordering question",
  "input": {
    "query": "how does react decide which pending update to process first",
    "command": "ask-context",
    "budget": "small"
  },
  "expected": {
    "must_include": [
      "Scheduler.js"
    ],
    "should_include": [
      "ReactFiberLane.js"
    ],
    "should_not_include": [
      "README.md"
    ],
    "max_files": 8,
    "max_bytes": 5000
  }
}
