{
  "id": "case-044",
  "category": "over-selection",
  "project": "ktor",
  "task": "Content negotiation with a tight 4-file limit",
  "input": {
    "query": "how are response bodies serialized through content negotiation",
    "command": "ask-context",
    "budget": "small"
  },
  "expected": {
    "must_include": [
      "ktor-server-content-negotiation"
    ],
    "should_include": [
      "ContentNegotiation.kt"
    ],
    "should_not_include": [
      "README.md"
    ],
    "max_files": 4,
    "max_bytes": 4000
  }
}
